id,title,short_description,full_description,instructions,materials,duration_minutes,difficulty,age_groups,category,skills_developed,location,tags,premium,season
creativity_016,Написание рассказа,Создание собственной истории,"Развитие литературных способностей через создание оригинальных произведений. Подросток учится структурировать повествование, создавать персонажей и увлекательные сюжеты.","Начните с идеи: что если? а что, если собака умела говорить? | Создайте главного героя: опишите его внешность, характер, мечты | Придумайте проблему или конфликт, который нужно решить | Определите место действия: опишите его детально | Набросайте план: завязка, развитие, кульминация, развязка | Пишите диалоги - они оживляют историю | Показывайте эмоции героев через действия | Придумайте неожиданный поворот или финал","Тетрадь или компьютер,ручка,черновики для заметок,словарь синонимов,таймер для письменных сессий",90,medium,13-17,creativity,"литературное творчество,воображение,структурирование,языковые навыки,планирование",indoor,"писательство,литература,творчество,язык",false,any
creativity_017,Фотопрогулка,Изучение мира через объектив,"Развитие художественного взгляда через фотографию. Подросток учится видеть красоту в обычных вещах, понимать композицию и работать со светом.","Выберите тему фотосессии: архитектура, природа, люди, детали | Изучите основы композиции: правило третей, ведущие линии | Обращайте внимание на освещение: как падает свет и тень | Экспериментируйте с ракурсами: снимайте сверху, снизу, сбоку | Делайте много кадров одного объекта с разных точек | Ищите необычные детали в обычных местах | Отберите лучшие фотографии | Создайте альбом или коллаж из снимков","Фотоаппарат или смартфон с хорошей камерой,заряженная батарея,карта памяти,блокнот для идей",60,easy,13-17,creativity,"художественное восприятие,композиция,работа со светом,наблюдательность,техническая грамотность",outdoor,"фотография,искусство,композиция,наблюдение",false,any
creativity_018,Создание коллажа,Композиция из разных материалов,"Художественная техника, развивающая чувство композиции и работу с различными материалами. Создание коллажа учит сочетать цвета, текстуры и формы в единое произведение.","Выберите тему: мечты, путешествия, любимые вещи, будущая профессия | Соберите материалы: журналы, фотографии, ткань, листья | Вырежьте интересные изображения и текстуры | Поэкспериментируйте с расположением на бумаге перед приклеиванием | Наслаивайте элементы для создания глубины | Добавьте рисованные детали маркерами | Играйте с контрастами и цветовыми сочетаниями | Покройте готовый коллаж прозрачной пленкой","Плотная основа (картон или ватман),старые журналы,личные фотографии,клей-карандаш,ножницы,цветные маркеры,природные материалы,ткани",50,easy,13-17,creativity,"композиция,цветовосприятие,работа с материалами,художественный вкус,планирование",indoor,"коллаж,композиция,материалы,искусство",false,any
creativity_019,Практика каллиграфии,Искусство красивого письма,"Изучение каллиграфии развивает терпение, концентрацию и эстетическое восприятие. Красивое письмо - это медитативная практика, которая успокаивает и развивает мелкую моторику.","Изучите базовые принципы: правильная осанка, положение ручки | Начните с простых упражнений: палочки, крючки, овалы | Тренируйте отдельные буквы, соблюдая пропорции | Изучите разные стили: печатный, курсив, готический | Копируйте красивые образцы из учебников | Напишите любимую цитату красивым почерком | Украсьте текст декоративными элементами | Создайте открытку с каллиграфическим поздравлением","Специальные каллиграфические ручки,качественная бумага с разметкой,образцы шрифтов,линейка,простой карандаш,ластик",60,medium,18+,creativity,"мелкая моторика,концентрация,эстетическое восприятие,терпение,внимание к деталям",indoor,"каллиграфия,красота,концентрация,традиция",false,any
creativity_020,Письмо благодарности,Выражение признательности,"Практика выражения благодарности развивает эмпатию и укрепляет отношения. Написание письма от руки показывает искренность чувств и заботу о получателе.","Подумайте о человеке, который много для вас значит | Вспомните конкретные поступки, за которые хотите поблагодарить | Выберите качественную бумагу и хорошую ручку | Начните с теплого обращения | Опишите, как действия этого человека повлияли на вас | Будьте конкретными: не просто 'спасибо за все', а 'спасибо за то, что...' | Добавьте личные воспоминания | Украсьте письмо рисунком или найденным засушенным цветком","Красивая бумага или открытка,качественная ручка,конверт,цветные карандаши,засушенные цветы или наклейки",30,easy,18+,creativity,"эмпатия,выражение чувств,письменная речь,благодарность,внимательность к людям",indoor,"благодарность,отношения,эмоции,письмо",false,any
creativity_021,Фрирайтинг,Свободное письмо без ограничений,"Техника развития креативности через непрерывное письмо. Фрирайтинг помогает преодолеть внутреннего критика, найти новые идеи и развить беглость письма.","Установите таймер на 15-20 минут | Возьмите ручку и бумагу (не компьютер!) | Начните писать о чем угодно и не останавливайтесь | Если не знаете, что писать, пишите 'не знаю, что писать' | Не редактируйте, не исправляйте ошибки | Позвольите мыслям течь свободно | Если застряли на одной мысли, продолжайте ее развивать | После завершения прочитайте и выделите интересные идеи","Несколько листов бумаги,удобная ручка,таймер,тихое место,маркер для выделения идей",25,easy,18+,creativity,"креативное мышление,преодоление блоков,поток сознания,самопознание,беглость письма",indoor,"креативность,письмо,поток,идеи",false,any
active_games_001,Гараж для машинок,Дороги и парковки из скотча,"Активная игра с элементами планирования и логики. Ребенок создает дорожную инфраструктуру и учится правилам дорожного движения, развивая пространственное мышление и мелкую моторику.","Освободите пространство на полу | Наклейте скотч, создавая дороги, перекрестки и парковочные места | Сделайте разметку: пешеходные переходы, стоп-линии | Расставьте машинки на парковке | Объясните правила: машины едут по правой стороне | Играйте в поездки: из дома в магазин, к врачу | Устройте парковочные соревнования: кто точнее припаркуется | Добавьте светофор из картона","Цветной малярный скотч или изолента,коллекция игрушечных машинок,картон для знаков,фломастеры,ножницы",25,medium,3-5,active_games,"пространственное мышление,правила дорожного движения,логика,мелкая моторика,планирование",indoor,"машинки,дороги,правила,планирование",false,any
active_games_002,Домашняя тренировка,Физические упражнения дома,"Комплексная физическая активность для поддержания здоровья и развития силы. Подросток учится самостоятельно заботиться о своей физической форме и развивает дисциплину.","Найдите свободное пространство размером 2x2 метра | Начните с 5-минутной разминки: вращения головой, руками, наклоны | Выполните силовые упражнения: 10 отжиманий, 15 приседаний, планка на 30 секунд | Сделайте кардио: прыжки на месте, бег на месте по 1 минуте | Завершите растяжкой всех групп мышц | Следите за правильной техникой выполнения | Увеличивайте нагрузку постепенно | Ведите дневник тренировок","Коврик для упражнений,спортивная одежда,бутылка воды,таймер,блокнот для записи результатов",30,easy,13-17,active_games,"физическая сила,выносливость,самодисциплина,здоровые привычки,целеполагание",indoor,"спорт,здоровье,сила,дисциплина",false,any
active_games_003,Осознанная прогулка,Прогулка без гаджетов с полным погружением в момент,"Медитативная практика в движении, развивающая внимательность и связь с окружающим миром. Учит замедляться и находить красоту в простых вещах.","Выберите маршрут на 30-45 минут без сложных переходов | Оставьте телефон дома или выключите все уведомления | Идите медленнее обычного в 2 раза | Сосредоточьтесь на дыхании первые 5 минут | Обращайте внимание на звуки: птицы, ветер, шаги | Рассматривайте детали: текстуры зданий, формы облаков | Замечайте запахи и ощущения ветра на коже | После прогулки запишите 3 новых наблюдения","Удобная обувь,одежда по погоде,небольшой блокнот,ручка,бутылка воды",45,easy,18+,active_games,"осознанность,стрессоустойчивость,наблюдательность,связь с природой,эмоциональная регуляция",outdoor,"медитация,осознанность,природа,замедление",false,any
learn_new_001,Сортировка сокровищ,Рассортировать предметы по типу,"Развивающая игра на классификацию и логическое мышление. Ребенок учится группировать предметы по различным признакам, развивая аналитические способности и внимание к деталям.","Смешайте в большой миске фасоль, пуговицы, макароны разной формы | Дайте ребенку контейнер от яиц или форму для льда | Объясните задание: разложить предметы по видам | Покажите пример: все красные пуговицы в одну ячейку | Можно сортировать по цвету, размеру, форме, материалу | Считайте вместе предметы в каждой группе | Обсуждайте признаки: это круглое, это шершавое | Похвалите за внимательность и аккуратность","Контейнер от яиц или форма для льда,разноцветная фасоль,пуговицы разных размеров и цветов,макароны разной формы,небольшие природные материалы",15,easy,3-5,learn_new,"классификация,логическое мышление,внимание к деталям,мелкая моторика,математические представления",indoor,"сортировка,логика,классификация,внимание",false,any
learn_new_002,Капсула времени,Послание себе в будущее,"Проект на развитие временных представлений и рефлексии. Ребенок создает послание для себя в будущем, учится думать о времени и изменениях.","Найдите прочную коробку с крышкой | Обсудите с ребенком: каким он станет через год | Напишите письмо будущему себе: что любите сейчас, о чем мечтаете | Положите фотографию, рисунок, любимую маленькую игрушку | Добавьте список роста и веса, отпечаток ладони | Запечатайте коробку скотчем | Напишите на коробке дату вскрытия | Спрячьте в безопасное место | Отметьте дату в календаре","Прочная коробка,бумага и ручка,скотч,фотографии,небольшие памятные предметы,календарь",40,easy,9-12,learn_new,"временные представления,планирование,рефлексия,письменная речь,эмоциональное развитие",indoor,"время,планирование,память,рефлексия",false,any
learn_new_003,Домашний квест,Поиск сокровищ по подсказкам,"Интеллектуальная игра на развитие логического мышления и внимательности. Ребенок решает загадки и следует подсказкам, развивая навыки решения проблем.","Придумайте финальный приз: книга, сладости, новая игрушка | Создайте 5-7 загадок о местах в доме | Например: 'Я холодный и большой, храню еду и лед зимой' (холодильник) | Спрячьте записки с подсказками в указанных местах | Каждая записка ведет к следующей | Сделайте подсказки соответствующими возрасту | Помогайте при затруднениях, но не давайте ответы сразу | Празднуйте успех в конце квеста","Цветная бумага,ручка или маркер,небольшой приз,возможно карта дома,конверты для записок",50,medium,9-12,learn_new,"логическое мышление,решение проблем,чтение,внимательность,настойчивость",indoor,"квест,логика,загадки,поиск",false,any
learn_new_004,Шифры и коды,Изучение тайного языка,"Введение в криптографию через игру. Ребенок изучает различные способы кодирования информации, развивая математическое и логическое мышление.","Начните с простого шифра замены: А=1, Б=2, В=3 | Зашифруйте имя ребенка и попросите расшифровать | Изучите шифр Цезаря: сдвиг букв на 3 позиции | Создайте свой секретный алфавит с символами | Попробуйте зеркальное письмо | Изучите азбуку Морзе для коротких слов | Зашифруйте секретное послание другу | Создайте шифровальную книгу с разными кодами","Бумага и ручки,линейка,таблица алфавита,зеркало,таблица Морзе,цветные карандаши",45,medium,9-12,learn_new,"математическое мышление,логика,внимательность,системное мышление,концентрация",indoor,"математика,шифры,логика,секреты",false,any
learn_new_005,Научный эксперимент,Домашняя лаборатория,"Знакомство с научным методом через безопасные эксперименты. Ребенок учится наблюдать, выдвигать гипотезы и делать выводы.","Выберите простой эксперимент: вулкан из соды и уксуса | Соберите материалы заранее | Объясните цель: узнать, что произойдет при смешивании | Попросите ребенка предположить результат | Проведите эксперимент пошагово | Наблюдайте и описывайте происходящее | Обсудите: почему так получилось? | Запишите результаты в научный дневник | Повторите эксперимент для проверки","Материалы для выбранного эксперимента,блокнот для записей,ручка,фартук или старая одежда,салфетки для уборки",45,medium,9-12,learn_new,"научное мышление,наблюдательность,критическое мышление,причинно-следственные связи,методичность",indoor,"наука,эксперимент,открытия,метод",false,any
learn_new_006,Письмо от руки,Красивое рукописное письмо,"Развитие навыков письменного общения и каллиграфии. Ребенок учится выражать мысли на бумаге и создавать красивые рукописные тексты.","Выберите адресата: бабушка, друг, любимый учитель | Обсудите содержание: что хотите рассказать | Сначала напишите черновик простым карандашом | Проверьте орфографию вместе | Выберите красивую бумагу для чистовика | Пишите аккуратно, не торопясь | Украсьте письмо рисунками по краям | Подпишите красиво | Запечатайте в конверт и отправьте по почте","Красивая бумага,хорошая ручка,простой карандаш,ластик,конверт,марка,цветные карандаши",30,easy,9-12,learn_new,"письменная речь,каллиграфия,выражение мыслей,терпение,внимание к деталям",indoor,"письмо,общение,каллиграфия,терпение",false,any
learn_new_007,Изучение нового навыка,Освоение чего-то нового за день,"Практика самостоятельного обучения и развития способности к концентрации. Подросток выбирает навык и интенсивно изучает его, развивая самодисциплину.","Выберите навык, который можно освоить за день: оригами, жонглирование, новые аккорды | Найдите качественные обучающие материалы: видео, статьи, книги | Составьте план изучения с перерывами каждые 30 минут | Начните с теоретического изучения | Переходите к практическим упражнениям | Записывайте прогресс и трудности | В конце дня продемонстрируйте навык семье | Запланируйте дальнейшее развитие навыка","Зависит от навыка,доступ к интернету,блокнот для записей,таймер,материалы для практики",180,medium,13-17,learn_new,"самообучение,концентрация,целеполагание,самодисциплина,планирование времени",indoor,"обучение,навыки,концентрация,цели",false,any
