id,title,short_description,full_description,instructions,materials,duration_minutes,difficulty,age_groups,category,skills_developed,location,tags,premium,season
gifts_004,Мыло ручной работы,Красивое мыло в подарок,Создание красивого и полезного подарка. Ребёнок изучает свойства материалов и создаёт уникальный продукт.,Натрите мыльную основу и растопите на водяной бане | Добавьте эфирное масло | Окрасьте красителем | Добавьте сухие цветы | Вылейте в формочку | Дайте застыть 4 часа | Извлеките | Упакуйте красиво,"Мыльная основа,эфирные масла,красители,силиконовые формочки,сухие цветы,упаковка",60,medium,9-12,gifts,"творчество,внимание к деталям,терпение,забота",indoor,"мыло,рукоделие,подарок,ароматы",false,any
experiments_002,Радуга в стакане,Опыт с плотностью жидкостей,Визуальный эксперимент с жидкостями разной плотности. Физические законы создают красивую радугу прямо в стакане.,Возьмите 5 стаканов | Налейте сироп разной концентрации | Окрасьте каждый в цвет радуги | Вливайте ложкой в высокий стакан начиная с самого тяжёлого | Жидкости не смешиваются — получается радуга | Обсудите почему слои не смешиваются,"5 стаканов,высокий прозрачный стакан,сахарный сироп,пищевые красители,ложка",30,easy,6-8,experiments,"понимание плотности,наблюдательность,аккуратность,научное мышление",indoor,"наука,плотность,радуга,опыт",false,any
experiments_003,Музыкальные стаканы,Стаканы как музыкальный инструмент,Эксперимент с акустикой. Обычные стаканы с разным количеством воды издают разные ноты.,Возьмите 7-8 одинаковых стаканов | Налейте воду на разную высоту | Ударьте по каждому ложкой | Заметьте: больше воды — ниже звук | Подберите уровни для 7 нот | Сыграйте простую мелодию | Запишите ноты рисунком,"7-8 стеклянных стаканов,вода,деревянная ложка",35,medium,6-8,experiments,"понимание звука,музыкальный слух,наблюдательность,научное мышление",indoor,"звук,музыка,акустика,наука",false,any
experiments_004,Невидимые чернила,Тайные послания лимонным соком,Знакомство с химическими реакциями через тайные послания. Ребёнок изучает окисление на практике.,Выдавите лимонный сок | Обмакните ватную палочку | Напишите послание | Дайте высохнуть | Нагрейте над лампой со взрослым | Надпись станет видна | Обсудите: почему так происходит | Попробуйте апельсиновый сок,"Лимон,белая бумага,ватная палочка,лампа (телефон без смартфона — только со взрослым)",25,easy,9-12,experiments,"понимание химии,любознательность,аккуратность,научное мышление",indoor,"химия,тайна,наука,опыты",false,any
experiments_005,Мост из бумаги,Инженерный вызов из листа бумаги,Инженерный конкурс на прочность. Ребёнок строит мост из бумаги и испытывает его весом монет.,Дайте 5 листов бумаги и скотч | Задача: мост между двумя стопками книг | Должен выдержать максимальный вес | 15 минут на строительство | Кладите монеты по одной | Считайте монеты до разрушения | Обсудите что усилило конструкцию,"5 листов бумаги,скотч,две стопки книг,монеты",45,medium,9-12,experiments,"инженерное мышление,конструирование,анализ,решение задач",indoor,"инженерия,конструкция,физика,испытание",false,any
reading_stories_003,Придумай продолжение,Сочиняем финал истории,Развитие творческого мышления через продолжение знакомой истории. Ребёнок придумывает финал и сравнивает с оригиналом.,Прочитайте начало сказки | Остановитесь на кульминации | Спросите: что будет дальше? | Дайте подумать | Расскажите своё продолжение | Задайте вопросы | Запишите или нарисуйте финал | Прочитайте настоящий финал и сравните,"Книга или сказка,бумага и ручка,цветные карандаши",40,easy,6-8,reading_stories,"воображение,нарратив,развитие речи,критическое мышление",indoor,"сказка,история,воображение,речь",false,any
reading_stories_004,Семейный книжный клуб,Читаем и обсуждаем вместе,Традиция совместного чтения и обсуждения. Развивает критическое мышление и умение выражать мнение.,Выберите книгу для всех | Установите дедлайн | Каждый читает сам | В выходной обсудите вместе | Назовите любимый момент | Обсудите персонажей | Поспорьте о поступках героев | Выберите следующую книгу,"Книга,блокнот,чай для уюта",90,medium,9-12,reading_stories,"критическое мышление,умение слушать,выражение мнения,анализ",indoor,"чтение,обсуждение,семья,книги",false,any
reading_stories_005,История по картинкам,Сторителлинг по случайным картинкам,Развитие устной речи через визуальные стимулы. Ребёнок составляет историю по трём случайным картинкам.,Вырежьте 15 картинок из журналов | Перемешайте | Каждый берёт 3 случайные картинки | Придумать историю с тремя картинками | 3 минуты на подготовку | Рассказывайте по очереди | Следующий продолжает своими картинками | Оцените самую смешную историю,"Старые журналы,ножницы",35,easy,6-8,reading_stories,"устная речь,воображение,нарратив,творческое мышление",indoor,"история,речь,воображение,игра",false,any
learn_new_015,Звёздное небо,Изучаем созвездия,Астрономия для начинающих. Ребёнок изучает основные созвездия и их мифологические истории.,Скачайте приложение Star Walk или Sky Map | Найдите Большую Медведицу | Найдите Полярную звезду | Изучите 3-4 созвездия с историями | Нарисуйте карту неба | Выйдите вечером и найдите изученные созвездия | Запишите наблюдения,"Смартфон с приложением для звёзд,блокнот",60,medium,9-12,learn_new,"астрономия,внимательность,научное мышление,мифология",outdoor,"звёзды,астрономия,наука,природа",false,any
learn_new_016,Личный бюджет,Финансовая грамотность на практике,Финансовая грамотность для подростков. Учёт доходов и расходов и постановка финансовых целей.,Запишите все доходы | Разделите расходы по категориям | Ведите дневник расходов неделю | Проанализируйте куда ушло больше всего | Определите финансовую цель | Рассчитайте сколько откладывать | Правило: 10% от любого дохода в копилку,"Блокнот,ручка,калькулятор,копилка",30,easy,13-17,learn_new,"финансовая грамотность,планирование,самодисциплина,целеполагание",indoor,"деньги,бюджет,планирование,цели",false,any
learn_new_017,30 слов на новом языке,Изучение иностранных слов за день,Знакомство с иностранным языком через тематические карточки. Ребёнок учит 30 полезных слов с произношением.,"Выберите язык | Определите тему: еда или приветствия | Напишите 30 слов с переводом на карточках | Учите по 10 слов блоками | Проверяйте себя без карточек | Играйте: один показывает карточку, другой переводит | Используйте слова в течение дня","Карточки или стикеры,ручка,онлайн-словарь",60,easy,9-12,learn_new,"языковые способности,память,концентрация,культурная осведомлённость",indoor,"языки,память,культура,обучение",false,any
creativity_022,Рисование мандалы,Медитативное рисование симметричных узоров,Симметричные узоры развивают концентрацию. Создание мандалы успокаивает и вводит в состояние потока.,Нарисуйте круг с помощью циркуля | Разделите на 8 секторов | Рисуйте узоры от центра | Добавляйте слои симметричных лепестков | Каждый слой повторяет предыдущий | Обведите фломастером | Раскрасьте чередующимися цветами,"Бумага,циркуль,линейка,карандаш,чёрный фломастер,цветные карандаши",60,medium,13-17,creativity,"концентрация,симметрия,терпение,медитативность",indoor,"мандала,узор,медитация,рисование",false,any
creativity_023,Лепка из солёного теста,Фигурки из домашнего теста,Объёмные скульптуры из доступного материала. Фигурки запекаются и раскрашиваются — долговечная поделка.,"Смешайте 2 стакана муки, 1 стакан соли, 3/4 стакана воды | Вымесите однородно | Лепите фигурки | Хорошо надавливайте детали | Запекайте 150 градусов 1 час на сантиметр толщины | Остудите и раскрасьте акриловыми красками | Покройте лаком","Мука,соль,вода,духовка,акриловые краски,кисти,лак",120,easy,6-8,creativity,"мелкая моторика,пространственное мышление,терпение,художественный вкус",indoor,"лепка,тесто,скульптура,поделки",false,any
