id,title,short_description,full_description,instructions,materials,duration_minutes,difficulty,age_groups,category,skills_developed,location,tags,premium,season
learn_new_008,Разбор гардероба,Организация и стиль,"Практическая активность по организации пространства и развитию эстетического вкуса. Подросток учится принимать решения и создавать функциональные комплекты одежды.","Освободите всю одежду из шкафа | Рассортируйте по типам: верх, низ, обувь, аксессуары | Примерьте вещи, которые давно не носили | Создайте три кучи: оставить, подарить, выбросить | Оставляйте только то, что нравится и подходит | Создайте 5-7 готовых комплектов на разные случаи | Сфотографируйте удачные сочетания | Организуйте хранение: часто используемое - в доступе | Составьте список недостающих базовых вещей","Вся одежда,большое зеркало,хорошее освещение,пакеты для одежды на пожертвование,вешалки,смартфон для фото",120,easy,13-17,learn_new,"принятие решений,эстетический вкус,организация пространства,планирование,самооценка",indoor,"организация,стиль,решения,эстетика",false,any
learn_new_009,Планирование путешествия,Подготовка идеального отпуска,"Комплексная исследовательская деятельность, развивающая навыки планирования и изучения культур. Подросток создает детальный план путешествия мечты.","Выберите страну или город, который давно хотели посетить | Изучите климат, культуру, традиции этого места | Найдите топ-10 достопримечательностей | Составьте маршрут на 7 дней с учетом расстояний | Рассчитайте примерный бюджет: транспорт, жилье, еда, развлечения | Изучите местную кухню и выберите блюда для дегустации | Выучите 10 фраз на местном языке | Создайте презентацию или альбом с планом путешествия","Доступ к интернету,географические карты,блокнот для записей,калькулятор,цветные ручки,папка для материалов",90,medium,13-17,learn_new,"исследовательские навыки,планирование,бюджетирование,культурная осведомленность,систематизация",indoor,"путешествие,планирование,культура,исследование",false,any
learn_new_010,Микро-разбор,Идеальный порядок в одном месте,"Практика концентрации на малых задачах для получения быстрого результата. Развивает навыки организации и приносит немедленное удовлетворение от завершенной задачи.","Выберите одно конкретное место: ящик стола, полку, тумбочку | Полностью освободите выбранное пространство | Протрите поверхности влажной тряпкой | Рассортируйте вещи: нужное, ненужное, сомнительное | Выбросьте явно лишнее без сожалений | Сгруппируйте похожие предметы вместе | Разложите красиво и функционально | Подпишите или промаркируйте если нужно | Сфотографируйте результат для мотивации","Тряпки для уборки,мусорные пакеты,коробочки или органайзеры,этикетки,маркер,смартфон для фото до/после",20,easy,18+,learn_new,"организация,принятие решений,концентрация,завершение задач,удовлетворение",indoor,"организация,порядок,продуктивность,результат",false,any
learn_new_011,Свидание с собой,Качественное время наедине,"Практика самопознания и заботы о себе. Развивает способность наслаждаться собственным обществом и заботиться о своих потребностях.","Запланируйте 3-4 часа только для себя | Отключите телефон или поставьте в авиарежим | Выберите 3-4 любимых активности: чтение, рисование, ванна, готовка | Приготовьте что-то вкусное только для себя | Создайте уютную атмосферу: свечи, приятная музыка | Займитесь тем, что приносит радость, без цели продуктивности | Ведите дневник ощущений во время активности | Завершите день благодарностью себе за уделенное время","Зависит от выбранных активностей,свечи или лампы,приятная музыка,вкусная еда,дневник,удобная одежда",180,easy,18+,learn_new,"самопознание,самоуважение,релаксация,эмоциональная регуляция,осознанность",indoor,"самопознание,релаксация,забота,осознанность",false,any
learn_new_012,Планирование недели,Эффективная организация времени,"Развитие навыков тайм-менеджмента и стратегического планирования. Учит балансировать обязанности и личные интересы.","В воскресенье вечером проанализируйте прошедшую неделю | Отметьте что удалось, что нет, почему | Выпишите все задачи и обязанности на предстоящую неделю | Разделите на категории: работа/учеба, здоровье, отношения, хобби | Распределите задачи по дням, учитывая энергетические ритмы | Заложите буферное время для непредвиденных дел | Запланируйте время для отдыха и удовольствий | Подготовьте все необходимое с вечера | Каждый день делайте короткий обзор планов","Еженедельник или планнер,цветные ручки,стикеры,календарь,таймер",45,easy,18+,learn_new,"планирование времени,организация,целеполагание,самодисциплина,баланс жизни",indoor,"планирование,время,организация,баланс",false,any
learn_new_013,Домашний SPA-ритуал,Релаксация и уход за собой,"Практика заботы о физическом и эмоциональном благополучии. Создание ритуала релаксации развивает навыки стресс-менеджмента.","Освободите 2-3 часа вечером | Приготовьте ванну с морской солью и эфирными маслами | Включите расслабляющую музыку или звуки природы | Зажгите свечи, приглушите яркий свет | Сделайте маску для лица из натуральных ингредиентов | Заварите травяной чай: ромашка, мелисса, мята | Проведите самомассаж стоп с маслом | Завершите медитацией или дыхательными упражнениями | Ложитесь спать раньше обычного","Морская соль для ванн,эфирные масла,свечи,расслабляющая музыка,маска для лица,травяной чай,масло для массажа",150,easy,18+,learn_new,"стресс-менеджмент,самопознание,релаксация,забота о теле,эмоциональная регуляция",indoor,"релаксация,забота,здоровье,восстановление",false,any
learn_new_014,Цифровая детоксикация,День без гаджетов,"Практика осознанного отношения к технологиям. Развивает способность к концентрации и присутствию в моменте.","С вечера выключите все гаджеты и уберите их в другую комнату | Поставьте обычный будильник вместо телефона | Утром начните день без проверки уведомлений | Займитесь офлайн-активностями: чтение, рисование, прогулка | Готовьте еду осознанно, без фонового контента | Общайтесь с близкими лично или по телефону | Ведите дневник ощущений в течение дня | Обратите внимание на позывы взять телефон | Вечером проанализируйте опыт и ощущения","Механический будильник,книги,блокнот и ручка,настольные игры,материалы для творчества,контакты близких",480,medium,18+,learn_new,"самоконтроль,осознанность,концентрация,присутствие в моменте,цифровая гигиена",any,"детокс,осознанность,концентрация,присутствие",false,any
cooking_001,Создание своего рецепта,Кулинарное творчество,"Развитие кулинарных навыков и креативности через экспериментирование. Подросток учится сочетать ингредиенты и создавать уникальные блюда.","Выберите базу: паста, рис, омлет или салат | Определите основной ингредиент: мясо, рыба, овощи | Поэкспериментируйте со специями: понюхайте и выберите 2-3 | Попробуйте необычные сочетания: сладкий + соленый | Готовьте маленькими порциями для пробы | Записывайте все пропорции и действия | Дегустируйте и корректируйте вкус | Попросите семью оценить результат | Запишите финальный рецепт в кулинарную книгу","Базовые продукты для выбранного типа блюда,разнообразные специи,кулинарная тетрадь,ручка,мерные стаканы,весы",75,medium,13-17,cooking,"кулинарные навыки,креативность,дегустаторские способности,экспериментирование,документирование",indoor,"кулинария,творчество,эксперимент,вкус",false,any
cooking_002,Приготовление нового блюда,Освоение новой кухни,"Изучение культурных традиций через кулинарию. Развивает культурную осведомленность и расширяет кулинарные горизонты.","Выберите страну, кухня которой вас интересует | Изучите историю и традиции этой кухни | Найдите аутентичный рецепт традиционного блюда | Составьте список необычных ингредиентов | Посетите специализированный магазин или отдел | Изучите правильные техники приготовления | Следуйте рецепту точно в первый раз | Сервируйте блюдо в традиционном стиле | Изучите этикет приема пищи в этой культуре","Ингредиенты согласно выбранному рецепту,специальная посуда если нужна,кулинарные книги или интернет,блокнот для заметок",120,medium,18+,cooking,"кулинарные техники,культурная осведомленность,следование инструкциям,расширение кругозора,внимание к деталям",indoor,"кулинария,культура,традиции,новый опыт",false,any